{
  "$schema": "https://json-schema.org/draft/2020-12/schema",
  "$id": "https://agentctl.dev/contract/acc2/manifest.schema.json",
  "title": "agentd --capabilities manifest (ACC v2, informational)",
  "$comment": "ACC v2 treats the capabilities manifest as INFORMATIONAL, not the negotiation anchor: v1.3.1 emits no contract_version and no surfaces{} block (upstream ask U3), and under-reports (no webhooks key; workflows[].start_kinds omits webhook and stream). Negotiation anchors instead on the config schema's x-agentd-contract-version, the workflow schema $id, exit_codes, and metrics_schema (see SPEC.md §3). This schema is deliberately permissive (additive upstream changes must not break readers); requireds are the minimal stable core.",
  "type": "object",
  "required": ["runtime", "version"],
  "additionalProperties": true,
  "properties": {
    "runtime": { "type": "string", "const": "1", "description": "the config document generation ('1')" },
    "version": { "type": "string", "description": "the agentd semver, e.g. 1.3.1 — identify, never feature-detect from it" },
    "agent": {
      "type": "object", "additionalProperties": true,
      "properties": {
        "name": { "type": "string" },
        "instruction": { "type": "boolean" },
        "preflight": { "type": "string" }
      }
    },
    "intelligence": {
      "type": "object", "additionalProperties": true,
      "properties": { "endpoints": { "type": "integer" }, "model": { "type": ["string", "null"] } }
    },
    "mcp_servers": { "type": ["array", "integer", "null"] },
    "internal_tools": { "type": "array", "items": { "type": "string" } },
    "tools": {},
    "workflows": {
      "type": "array",
      "items": {
        "type": "object", "additionalProperties": true,
        "properties": {
          "name": { "type": "string" },
          "description": { "type": ["string", "null"] },
          "inputs_schema": { "type": "boolean" },
          "start_kinds": {
            "type": "array", "items": { "type": "string" },
            "description": "KNOWN GAP: webhook and stream starts report as absent/empty at 1.3.1 — do not infer 'no trigger' from an empty list"
          }
        }
      }
    },
    "knowledge": {},
    "search": {},
    "skills": {
      "type": "object", "additionalProperties": true,
      "properties": { "sources": { "type": "integer" } },
      "description": "KNOWN GAP: reports sources count only — skills.dir and inline skills are not reflected"
    },
    "a2a": {
      "type": ["object", "null"], "additionalProperties": true,
      "properties": {
        "listen": { "type": ["string", "null"] },
        "bearer": { "type": "boolean" },
        "admin": { "type": "array", "items": { "type": "string" } },
        "command_ops": {
          "type": "array", "items": { "type": "string" },
          "description": "KNOWN GAP: omits workflow-declared a2a commands"
        }
      }
    },
    "interface": { "type": "object", "additionalProperties": true },
    "store": { "type": ["string", "object", "null"] },
    "store_file": {
      "type": ["object", "null"], "additionalProperties": true,
      "properties": { "defaulted": { "type": "boolean" }, "path": { "type": "string" } }
    },
    "lifecycle": {
      "type": "object", "additionalProperties": true,
      "properties": {
        "daemon": {
          "type": "boolean",
          "description": "KNOWN GAP: under-reports for stream/webhook-start-only, a2a-start-only, webhooks.listen and goal instances — never the Deployment-vs-Job oracle; the operator decides shape from the rendered spec"
        },
        "run_until": { "type": "string" }
      }
    }
  }
}
